,Title,Published_date,Views,Likes,Comments
1522,Project 4: Indian Railways Announcement Software | Python Tutorials For Absolute Beginners #124,2019-09-14T11:45:00Z,141942,5130,483
1523,[Solved] Unable to install Pyaudio - How to install using .whl wheel file,2019-09-13T05:29:56Z,218581,5115,966
1524,Alarm Clock In JavaScript | JavaScript Tutorial In Hindi #54,2019-09-11T04:35:24Z,42115,1318,114
1525,Should I learn PHP for Job?,2019-09-06T02:54:26Z,138298,6841,519
1526,Project 3: Third Umpire Decision Review System (DRS Gully Cricket) |Python Tutorials in Hindi #123,2019-09-04T04:50:47Z,213950,7316,756
1527,Top 5 programming languages,2019-09-01T16:10:12Z,211589,4204,551
1528,Generators in Javascript | JavaScript Tutorial In Hindi #53,2019-08-31T14:30:01Z,44191,1766,74
1529,Android Development Tutorial in Hindi,2019-08-30T03:06:44Z,2487682,84745,13294
1530,Creating an Alarm App: Exercise 6 | JavaScript Tutorial In Hindi #52,2019-08-28T14:45:00Z,28963,1000,58
1531,Iterators in JavaScript | JavaScript Tutorial In Hindi #51,2019-08-27T14:43:36Z,47804,1710,69
1532,Project 4: Form Validation using Regular Expressions | JavaScript Tutorial In Hindi #50,2019-08-26T14:30:02Z,74143,2124,145
1533,"Evaluating Classifiers in Python: Precision, Recall & F1 Score | Machine Learning Tutorials In Hindi",2019-08-25T14:30:00Z,34449,934,154
1534,Shorthand character classes (Regular Expressions) | JavaScript Tutorial In Hindi #49,2019-08-24T15:05:37Z,35971,1664,50
1535,Regular Expressions - Character sets | JavaScript Tutorial In Hindi #48,2019-08-23T15:03:14Z,41219,1859,80
1536,Regular Expressions - Metacharacters in JavaScript | JavaScript Tutorial In Hindi #47,2019-08-22T15:01:55Z,48805,2021,86
1537,JavaScript Regular Expressions & related functions | JavaScript Tutorial In Hindi #46,2019-08-21T14:51:40Z,112315,3709,144
1538,Using JavaScript Objects Exercise 5: Solution | JavaScript Tutorial In Hindi #45,2019-08-20T14:30:04Z,29688,1057,57
1539,"Precision, Recall, Confusion matrix & F1-Score | Machine Learning Tutorials Using Python In Hindi",2019-08-19T16:29:55Z,61482,1870,317
1540,Error Handling & Try Catch in Javascript | JavaScript Tutorial In Hindi #44,2019-08-18T14:30:00Z,63471,2109,128
1541,Handwritten Digit Recognition on MNIST dataset | Machine Learning Tutorials Using Python In Hindi,2019-08-17T14:30:02Z,166007,3409,258
1542,Async/Await in Javascript | JavaScript Tutorial In Hindi #43,2019-08-16T14:26:07Z,223696,6269,234
1543,Fetch api in Javascript | JavaScript Tutorial In Hindi #42,2019-08-15T14:38:19Z,238418,5672,257
1544,Arrow functions in Javascript | JavaScript Tutorial In Hindi #41,2019-08-14T14:30:00Z,83525,2628,73
1545,Project 1: End To End Python ML Project (Complete)| Machine Learning Tutorials Using Python In Hindi,2019-08-13T13:48:52Z,820671,22419,2353
1546,Project 3: Creating a News Website | JavaScript Tutorial In Hindi #40,2019-08-12T14:02:08Z,138576,3221,443
1547,"Promises Basics, Promise.then() & Promise.catch() | JavaScript Tutorial In Hindi #39",2019-08-11T12:00:01Z,218200,5453,385
1548,Coding Logistic Regression In Python | Machine Learning Tutorials Using Python In Hindi,2019-08-10T14:55:09Z,89409,2662,195
1549,Java tutorial in hindi 🔥,2019-08-09T15:15:00Z,2389655,67030,6583
1550,Using a Dictionary API Exercise 5 | JavaScript Tutorial In Hindi #38,2019-08-08T14:34:44Z,45076,1205,72
1551,Callback functions in javascript | JavaScript Tutorial In Hindi #37,2019-08-07T14:30:02Z,189013,5701,653
1552,Library Class Implementation Exercise 4: Solution | JavaScript Tutorial In Hindi #36,2019-08-06T14:30:00Z,44095,1231,58
1553,Ajax tutorial in hindi | JavaScript Tutorial In Hindi #35,2019-08-05T14:32:57Z,427226,9325,461
1554,What is Asynchronous Programming? | JavaScript Tutorial In Hindi #34,2019-08-04T14:30:00Z,111538,4075,99
1555,Project 2: Building a College Library Website | JavaScript Tutorial In Hindi #33,2019-08-03T18:47:33Z,215631,5900,710
1556,Implementing a library class - Exercise 4 | JavaScript Tutorial In Hindi #32,2019-08-02T05:06:09Z,41570,1417,116
1557,ES6 Classes and Inheritance | JavaScript Tutorial In Hindi #31,2019-07-31T14:30:49Z,112570,3481,157
1558,Prototype Inheritance In JavaScript | JavaScript Tutorial In Hindi #30,2019-07-30T15:33:40Z,84058,2339,213
1559,Notes App with Title - Exercise 3: Solution | JavaScript Tutorial In Hindi #29,2019-07-29T05:53:09Z,56023,1620,110
1560,Python Tutorial In Hindi 🔥,2019-07-27T15:47:50Z,1967748,68408,9093
1561,Object Prototype In javascript | JavaScript Tutorial In Hindi #28,2019-07-26T12:06:32Z,106199,3046,115
1562,Docker Tutorial in Hindi,2019-07-25T03:21:03Z,454346,12811,1411
1563,"Object Literals, Constructors and Object Oriented JavaScript | JavaScript Tutorial In Hindi #27",2019-07-23T06:45:08Z,118220,3892,136
1564,Improving Magic Notes Website Exercise 3 | JavaScript Tutorial In Hindi #26,2019-07-22T16:52:29Z,44851,1489,119
1565,Creating an Editable Div Exercise 2: Solution | JavaScript Tutorial In Hindi #25,2019-07-22T06:05:02Z,78752,2168,217
1566,Date Object: Date & Time In JavaScript | JavaScript Tutorial In Hindi #24,2019-07-21T13:45:37Z,70942,2460,54
1567,Math Object In JavaScript | JavaScript Tutorial In Hindi #23,2019-07-21T07:26:44Z,74513,2639,86
1568,Project 1: Build a Notes Taking Website Using Pure JavaScript | JavaScript Tutorial In Hindi #22,2019-07-20T15:59:15Z,300997,6156,929
1569,Creating Editable Div Using JavaScript: Exercise 2 | JavaScript Tutorial In Hindi #21,2019-07-20T07:08:29Z,78560,2362,207
1570,Local & Session storage in JavaScript | JavaScript Tutorial In Hindi #20,2019-07-19T13:58:23Z,160465,4384,185
1571,Smart Page Crawler In JS Exercise1: Solution | JavaScript Tutorial In Hindi #19,2019-07-19T06:35:47Z,99559,2877,120
1572,More on JavaScript Events | JavaScript Tutorial In Hindi #18,2019-07-18T14:42:16Z,98116,3218,134
1573,Events & Event Object In JavaScript | JavaScript Tutorial In Hindi #17,2019-07-18T05:18:44Z,125673,3771,90
1574,"Creating, Removing & Replacing Elements | JavaScript Tutorial In Hindi #16",2019-07-17T16:16:59Z,141446,3748,276
1575,"Children, Parent & Traversing the DOM | JavaScript Tutorial In Hindi #15",2019-07-17T03:27:04Z,151143,4536,153
1576,HTML Element Selectors In JavaScript | JavaScript Tutorial In Hindi #14,2019-07-16T13:11:59Z,202849,5234,188
1577,WebPage Crawler In JavaScript - Exercise 1 | JavaScript Tutorial In Hindi #13,2019-07-16T04:58:55Z,142716,3718,798
1578,Understanding DOM & Creating a Website Layout | JavaScript Tutorial In Hindi #12,2019-07-15T15:41:03Z,268273,7904,377
1579,Manipulating Websites Using JS Window Object | JavaScript Tutorial In Hindi #11,2019-07-15T03:00:01Z,187021,6207,102
1580,Functions in JavaScript | JavaScript Tutorial In Hindi #10,2019-07-14T16:30:01Z,225855,5950,185
1581,"For, While & Do while Loops in JavaScript | JavaScript Tutorial In Hindi #9",2019-07-14T12:43:43Z,193565,5514,156
1582,If Else Conditionals & Switches in JavaScript | JavaScript Tutorial In Hindi #8,2019-07-14T07:42:31Z,182378,5284,185
1583,Arrays and Objects In JavaScript | JavaScript Tutorial In Hindi #7,2019-07-13T14:30:02Z,238757,7060,210
1584,"Strings: Properties, Methods & Template Literals in JavaScript | JavaScript Tutorial In Hindi #6",2019-07-13T10:25:00Z,220933,6575,605
1585,JavaScript Type Conversion & Coercion | JavaScript Tutorial In Hindi #5,2019-07-13T06:03:04Z,232893,7456,347
1586,Data Types in JavaScript (Primitive & Reference Types) | JavaScript Tutorial In Hindi #4,2019-07-12T17:57:26Z,267078,8321,280
1587,"Variables: let, const & var in JavaScript | JavaScript Tutorial In Hindi #3",2019-07-12T04:20:47Z,356269,9869,711
1588,"Console Logs, Errors, Warnings & More | JavaScript Tutorial In Hindi #2",2019-07-11T16:55:25Z,459531,10604,382
1589,"Installing VS Code, Extensions & Setup | JavaScript Tutorial In Hindi #1",2019-07-11T05:14:26Z,1133262,23676,3933
1590,Implementing Google Recaptcha In Python Django (Tutorial),2019-07-08T14:02:56Z,10626,336,77
1591,Python Pandas Tutorial in Hindi,2019-07-04T18:35:42Z,690545,17315,691
1592,Numpy Tutorial in Hindi,2019-07-03T03:46:19Z,541185,15222,564
1593,Area of Circle In C Exercise 14 Solution: C Tutorial In Hindi #76,2019-07-02T03:00:00Z,117825,2438,366
1594,Memory Leak In C: C Tutorial In Hindi #75,2019-07-01T03:00:00Z,51822,1850,97
1595,Exercise 14 Area of the Circle Using Function Pointers: C Tutorial In Hindi #74,2019-06-30T08:48:06Z,36149,950,59
1596,Callback Functions Using Function Pointers In C: C Tutorial In Hindi #73,2019-06-29T06:43:33Z,48320,1671,85
1597,Function Pointers In C: C Tutorial In Hindi #72,2019-06-28T14:54:09Z,63505,2191,69
1598,Linux Tutorial For Beginners in Hindi,2019-06-27T03:30:59Z,1942704,60703,5641
1599,[Solved] Command Line Calculator In C Ex.13 : C Tutorial In Hindi #71,2019-06-25T15:26:47Z,32018,1012,66
1600,Command Line Calculator In C - Exercise 13: C Tutorial In Hindi #70,2019-06-23T02:30:00Z,27935,1005,40
1601,Automated Bill Generator In C (Solution) - Exercise 12: C Tutorial In Hindi #69,2019-06-22T12:01:41Z,51858,1464,150
1602,Command Line Arguments In C: C Tutorial In Hindi #68,2019-06-21T03:30:00Z,95690,3335,67
1603,"File modes, fgets, fputs, fgetc, fputc & more on C file handling: C Tutorial In Hindi #67",2019-06-20T05:07:46Z,209590,5984,268
1604,Automated Receipt Generator In C - Exercise 12: C Tutorial In Hindi #66,2019-06-19T05:11:47Z,37586,1182,55
1605,Palindrome Number Program in C Language: C Tutorial In Hindi #65,2019-06-17T12:50:03Z,77155,2039,89
1606,Functions For File I/O In C Language: C Tutorial In Hindi #64,2019-06-16T07:35:04Z,105011,3506,84
1607,Check Palindrome In C Language - Exercise 11: C Tutorial In Hindi #63,2019-06-15T06:30:11Z,45023,1393,107
1608,File I/O In C: C Tutorial In Hindi #62,2019-06-14T12:36:45Z,87625,3525,60
1609,Matrix Multiplication in C - Exercise 10 Solution: C Tutorial In Hindi #61,2019-06-13T12:28:25Z,111906,2898,110
1610,Predefined Macros & Other Pre-processor Directives: C Tutorial In Hindi #60,2019-06-12T05:23:31Z,63578,2428,112
1611,#define and #include Preprocessor Directives: C Tutorial In Hindi #59,2019-06-11T13:12:37Z,75587,2833,121
1612,Project 2: Coding Flappy Bird Game (With Source Code) | Python Tutorials For Absolute Beginners #122,2019-06-10T02:07:15Z,664068,21546,3216
1613,C Pre-processor Introduction & Working: C Tutorial In Hindi #58,2019-06-09T02:30:00Z,77897,2956,261
1614,Matrix Multiplication In C Language - Exercise 10: C Tutorial In Hindi #57,2019-06-08T12:15:01Z,37262,1322,95
1615,"Rock, Paper & Scissors In C Language - Exercise 9 Solution: C Tutorial In Hindi #56",2019-06-08T02:30:00Z,59995,1790,207
1616,Wild Pointer In C Language: C Tutorial In Hindi #55,2019-06-07T12:15:00Z,41398,1919,91
1617,Dangling Pointer In C Language: C Tutorial In Hindi #54,2019-06-07T02:30:00Z,59617,2442,80
1618,NULL Pointer In C Language: C Tutorial In Hindi #53,2019-06-06T12:15:00Z,60703,2345,51
1619,Void Pointer In C Language: C Tutorial In Hindi #52,2019-06-06T02:30:00Z,69973,2795,98
1620,"Coding Rock, Paper, Scissors In C Exercise 9: C Tutorial In Hindi #51",2019-06-05T11:57:03Z,53000,2011,383
1621,Employee Manager In C - Exercise 8 Solution: C Tutorial In Hindi #50,2019-06-05T02:30:00Z,50069,1665,130
1622,"Storage Classes In C Auto, Extern, Static & Register Storage Classes: C Tutorial In Hindi #49",2019-06-04T13:23:22Z,138541,4313,107
1623,C Language Employee Manager Exercise 8: C Tutorial In Hindi #48,2019-06-01T11:45:00Z,53489,1742,142
1624,Dynamic Memory Allocation Malloc Calloc Realloc & Free(): C Tutorial In Hindi #47,2019-05-30T16:35:39Z,298984,10332,375
1625,C Language Travel Agency Manager Exercise 7 Solution: C Tutorial In Hindi #46,2019-05-28T12:15:01Z,68608,1978,199
1626,Memory Layout of C Programs - Dynamic Memory Allocation : C Tutorial In Hindi #45,2019-05-27T03:00:02Z,173346,5747,128
1627,C Language Travel Agency Manager Exercise 7: C Tutorial In Hindi #44,2019-05-26T05:09:20Z,59252,1932,240
1628,C Tutorial HTML Parser Exercise 6: Solution and Shoutouts: C Tutorial In Hindi #43,2019-05-25T09:36:45Z,77115,2229,247
1629,Static Variables In C: C Tutorial In Hindi #42,2019-05-24T16:05:56Z,120244,3817,136
1630,C Language HTML Parser Exercise 6: C Tutorial In Hindi #41,2019-05-22T05:18:54Z,77597,2261,185
1631,C Language Array Reversal Exercise 5: Solution: C Tutorial In Hindi #40,2019-05-21T03:35:45Z,98018,2975,229
1632,Unions In C: C Tutorial In Hindi #39,2019-05-20T02:30:00Z,141396,5172,737
1633,Typedef In C: C Tutorial In Hindi #38,2019-05-19T12:15:02Z,128026,4803,483
1634,Structures In C: C Tutorial In Hindi #37,2019-05-19T02:30:00Z,344203,11324,307
1635,Array Reversal In C - Exercise 5: C Tutorial In Hindi #36,2019-05-18T12:15:00Z,90562,2653,300
1636,String Functions In C & string.h Library: C Tutorial In Hindi #35,2019-05-18T02:30:00Z,190706,5672,265
1637,Strings In C: C Tutorial In Hindi #34,2019-05-17T12:15:01Z,293649,8759,607
1638,Star Pattern In C - Exercise 4 Solution: C Tutorial In Hindi #33,2019-05-17T02:30:02Z,112195,3204,124
1639,Passing Arrays As Function Arguments: C Tutorial In Hindi #32,2019-05-16T13:54:42Z,191475,5764,238
1640,Call by Value & Call By Reference In C: C Tutorial In Hindi #31,2019-05-16T02:30:00Z,256498,7856,593
1641,Exercise 4: Printing Star Patterns In C: C Tutorial In Hindi #30,2019-05-15T12:15:01Z,117034,3784,557
1642,Is Recursion Always Good? : C Tutorial In Hindi #29,2019-05-15T03:56:28Z,110229,4324,1282
1643,Exercise 3 On Recursions: Solution + Shoutouts: C Tutorial In Hindi #28,2019-05-14T13:40:02Z,149115,3808,137
1644,Arrays And Pointer Arithmetic In C: C Tutorial In Hindi #27,2019-05-13T19:08:39Z,335936,10667,572
1645,C++ Tutorial For Beginners: Learn C Plus Plus In Hindi,2019-05-12T15:51:24Z,2627790,101761,12707
1646,Pointers In C: C Tutorial In Hindi #26,2019-05-11T10:13:35Z,567614,20023,473
1647,Exercise 3 On Recursions: C Tutorial In Hindi #25,2019-05-10T04:44:48Z,172067,4307,334
1648,VS Code Tutorial + Python Setup | Python Tutorials For Absolute Beginners In Hindi #121,2019-05-08T17:19:26Z,797296,30799,2158
1649,Exercise 2: Solution + Shoutouts: C Tutorial In Hindi #24,2019-05-08T05:14:50Z,210481,4475,254
1650,Arrays In C: C Tutorial In Hindi #23,2019-05-07T05:26:54Z,776388,20534,383
1651,C Exercise 2: Units and Conversions: C Tutorial In Hindi #22,2019-05-06T05:26:29Z,193266,5122,781
1652,Recursive Functions: Recursion In C: C Tutorial In Hindi #21,2019-05-05T16:30:00Z,478391,14483,524
1653,C Exercise 1: Multiplication Table Solution + Shoutouts: C Tutorial In Hindi #20,2019-05-05T11:46:31Z,297629,7167,302
1654,Hosting Django Website On Ubuntu VPS | Python Django Tutorials In Hindi #70,2019-05-04T17:42:31Z,54514,997,181
1655,Functions In C: C Tutorial In Hindi #19,2019-05-04T11:55:09Z,745798,19477,979
1656,Typecasting In C: C Tutorial In Hindi #18,2019-05-03T12:15:00Z,307998,10926,129
1657,Goto Statement In C: C Tutorial In Hindi #17,2019-05-02T17:15:25Z,341138,15904,295
1658,Project 1: Iron Man Jarvis AI Desktop Voice Assistant | Python Tutorials For Absolute Beginners #120,2019-05-01T17:01:02Z,3206377,119782,17178
1659,Break and Continue Statements In C: C Tutorial In Hindi #16,2019-05-01T07:32:33Z,411412,13521,625
1660,For Loop In C: C Tutorial In Hindi #15,2019-04-30T12:12:25Z,501789,17203,795
1661,While Loop In C: C Tutorial In Hindi #14,2019-04-29T14:42:30Z,377351,13891,259
1662,Do While Loop In C: C Tutorial In Hindi #13,2019-04-29T02:30:00Z,515892,15228,515
1663,Loops In C: C Tutorial In Hindi #12,2019-04-28T14:05:14Z,540325,20103,721
1664,Switch Case Control Statements In C: C Tutorial In Hindi #11,2019-04-28T08:45:08Z,666139,19256,1239
1665,If Else Control Statements In C: C Tutorial In Hindi #10,2019-04-28T02:30:00Z,813186,23525,2572
1666,C Format Specifiers and Escape Sequences With Examples : C Tutorial In Hindi #9,2019-04-27T12:10:03Z,761109,22836,669
1667,C Programming Exercise 1 - Multiplication Tables: C Tutorial In Hindi #8,2019-04-27T02:30:01Z,667897,22635,6342
1668,Operators In C: C Tutorial In Hindi #7,2019-04-26T11:45:00Z,1109002,31351,1101
1669,Variables & Data Types In C: C Tutorial In Hindi #6,2019-04-25T11:45:00Z,1078617,40579,1976
1670,Basic Syntax Of A C Program: C Tutorial In Hindi #5,2019-04-24T11:45:01Z,1058338,38281,3179
1671,Basic Structure of C Program in Hindi: C Tutorial In Hindi #4,2019-04-23T11:45:01Z,1727361,44032,2188
1672,Install & Configure VS Code With C Compiler: C Tutorial In Hindi #3,2019-04-22T03:30:00Z,3728743,90628,8656
1673,What Is Coding & C Programming Language? : C Tutorial In Hindi #2,2019-04-21T11:45:00Z,1536462,77306,3572
1674,Why Learn C Programming Language? : C Tutorial In Hindi #1,2019-04-20T11:45:00Z,3326643,165192,30923
1675,Python Problem 9: Jumbled Funny Names | Python Tutorials For Absolute Beginners In Hindi #119,2019-04-20T02:30:00Z,39505,1026,256
1676,Python Problem 8: Solution | Python Tutorials For Absolute Beginners In Hindi #118,2019-04-19T13:59:18Z,19070,563,51
1677,Python Problem 8: Fake Multiplication Tables | Python Tutorials For Absolute Beginners In Hindi #117,2019-04-19T03:30:01Z,18134,749,174
1678,Python Problem 7: Solution | Python Tutorials For Absolute Beginners In Hindi #116,2019-04-18T13:44:09Z,22182,777,63
1679,Python Problem 7: Creating A Search Engine | Python Tutorials For Absolute Beginners In Hindi #115,2019-04-18T05:31:01Z,41199,1417,146
1680,Python Problem 6: Solution | Python Tutorials For Absolute Beginners In Hindi #114,2019-04-17T14:15:59Z,15237,598,45
1681,Python Problem 6 | Python Tutorials For Absolute Beginners In Hindi #113,2019-04-17T03:30:00Z,17362,698,256
1682,Python Problem 5: Solution | Python Tutorials For Absolute Beginners In Hindi #112,2019-04-16T16:39:38Z,15375,510,44
1683,Python Problem 5 | Python Tutorials For Absolute Beginners In Hindi #111,2019-04-16T03:03:47Z,17675,730,236
1684,Python Problem 4: Solution | Python Tutorials For Absolute Beginners In Hindi #110,2019-04-15T14:46:45Z,19100,660,69
1685,Python Problem 4 | Python Tutorials For Absolute Beginners In Hindi #109,2019-04-14T14:30:00Z,19835,776,249
1686,Python Problem 3: Solution | Python Tutorials For Absolute Beginners In Hindi #108,2019-04-14T09:31:24Z,20091,709,73
1687,CSS 3 Tutorial For Beginners: Learn CSS In One Video In Hindi,2019-04-13T17:43:27Z,410905,12768,1137
1688,Python Practice 3 | Python Tutorials For Absolute Beginners In Hindi #107,2019-04-12T12:15:00Z,21703,907,225
1689,Python Practice 2 Solution | Python Tutorials For Absolute Beginners In Hindi #106,2019-04-12T02:57:36Z,18783,793,83
1690,Practice Problem 2 (Easy) |  Python Tutorials For Absolute Beginners In Hindi #105,2019-04-11T12:15:01Z,25160,1059,383
1691,Python Practice 1 Solution | Python Tutorials For Absolute Beginners In Hindi #104,2019-04-11T04:33:30Z,34655,925,76
1692,Practice Problem 1 (Easy) |  Python Tutorials For Absolute Beginners In Hindi #103,2019-04-10T12:00:13Z,62974,2196,529
1693,JavaScript Registration Form Validation Tutorial In Hindi - हिंदी में,2019-04-09T13:10:22Z,240625,5769,229
1694,Reset Forgotten Admin Password In Django| Python Django Tutorials In Hindi #69,2019-04-09T02:30:00Z,27250,594,65
1695,[Solved] gcc is not recognized as an internal or external command operable program or batch file,2019-04-08T13:15:01Z,576568,8991,4379
1696,C Programming Tutorial For Beginners: Learn C In Hindi,2019-04-08T02:30:00Z,638656,19075,2851
1697,Login And Registration Form Using Php & MySQL [Php Login System In Hindi],2019-04-06T12:15:00Z,269703,6256,644
1698,"Create A Responsive Website Using HTML, CSS And Bootstrap 4 In Hindi",2019-04-05T18:48:18Z,134171,4273,283
1699,Fixing A Bug In Django E Commerce Website Tracker | Python Django Tutorials In Hindi #68,2019-04-04T17:50:49Z,16955,446,76
1700,Creating Product Search Feature In Our E Commerce Website | Python Django Tutorials In Hindi #67,2019-03-31T12:05:02Z,29073,784,108
1701,"Integrating Payment Gateway: PayTM, UPI, Cards & NetBanking | Python Django Tutorials In Hindi #66",2019-03-31T05:47:28Z,115805,2506,615
1702,"Integrating Facebook Like, Comments & Shares In Django Blog | Python Django Tutorials In Hindi #65",2019-03-30T12:15:01Z,22498,957,136
1703,Linking Django Blog Posts To Blog Home | Python Django Tutorials In Hindi #64,2019-03-30T08:20:00Z,11030,439,59
1704,jQuery Tutorial For Beginners In Hindi - हिंदी में,2019-03-29T02:50:51Z,472216,14346,789
1705,Social Networking Website In PHP in 5 Minutes,2019-03-26T03:55:48Z,20054,648,49
1706,Hosting A PHP Website Using DigitalOcean One Click Install On Ubuntu 18 (Linux+Apache+PHP+MySql),2019-03-25T12:15:01Z,3752,49,8
1707,Installing Wordpress On DigitalOcean VPS Droplet (Super Quick),2019-03-25T02:30:00Z,2165,71,15
1708,SSH Keys Deployment Tutorial On Ubuntu 18 VPS In Hindi (Password Free Login),2019-03-24T12:15:02Z,6400,231,34
1709,Putty Tutorial To Connect To A Digitalocean VPS Droplet(Beginner Friendly),2019-03-24T05:26:49Z,6963,146,25
1710,FileZilla Tutorial: Transfer Files Between Client And Remote Server Using SFTP In DigitalOcean,2019-03-23T11:30:49Z,10011,171,39
1711,Important Apache2 Files and Directories For Web Server Administrators! | Apache2 Error/Access Logs,2019-03-23T05:54:50Z,4040,130,19
1712,How to Host Flask App On Ubuntu 18 VPS Using Virtual Environment! (Python Website Hosting),2019-03-22T18:07:35Z,7820,146,30
1713,Hosting Multiple PHP Websites On One Single Ubuntu 18.04 DigitalOcean VPS Using Apache Server,2019-03-21T17:35:57Z,12652,292,40
1714,Git & GitHub Tutorial For Beginners In Hindi - हिंदी में,2019-03-20T02:33:05Z,1874690,63458,2132
1715,How To Install PHP MyAdmin On Digital Ocean? Linux VPS Setup Guide,2019-03-06T05:15:32Z,9871,245,59
1716,"Installing LAMP (Linux, Apache, MySQL & PHP) Stack On DigitalOcean",2019-03-05T05:24:45Z,19683,517,44
1717,Initial Server Setup Using Digital Ocean On Ubuntu 18 VPS | Creating A Droplet + Sudo User,2019-03-03T10:00:03Z,33139,1074,137
1718,What is a VPS & How To Use Digital Ocean?,2019-03-02T14:13:08Z,60000,2484,87
1719,Django Exercise 5: Solution + Shoutouts | Python Django Tutorials In Hindi #63,2019-03-02T02:30:00Z,8284,472,32
1720,Designing The Blog Home Page | Python Django Tutorials In Hindi #62,2019-03-01T12:15:01Z,13256,496,68
1721,Creating a Django Post Page For Displaying Blog Content | Python Django Tutorials In Hindi #61,2019-03-01T02:30:00Z,13704,389,49
1722,Django Exercise 5: BlogPosts | Python Django Tutorials In Hindi #60,2019-02-28T12:15:00Z,10326,379,44
1723,Creating Models For Blog In Our E-Commerce Website | Python Django Tutorials In Hindi #59,2019-02-28T02:30:00Z,14675,396,35
1724,My Awesome Cart: Creating The Blog | Python Django Tutorials In Hindi #58,2019-02-27T12:15:01Z,17989,475,20
1725,How To Create A Currency Converter In Python? | Python Programming Practice (Hindi),2019-02-27T03:53:23Z,62636,1590,136
1726,How To Create A Python HTTP Server For Web Development?,2019-02-26T12:15:01Z,58782,1619,88
1727,Django Website My Awesome Cart: Pull Requests | Python Django Tutorials In Hindi #57,2019-02-26T02:30:00Z,14442,396,40
1728,How To Find Factorial & No Of Trailing Zeros In A Factorial Of A Number In Python?,2019-02-25T12:15:01Z,47659,1732,286
1729,Django Website TextUtils: Pull Requests | Python Django Tutorials In Hindi #56,2019-02-25T02:30:00Z,10983,371,30
1730,How to Create An Indian Kirana Store Calculator & Receipt Generator In Basic Python?,2019-02-24T12:15:00Z,223000,7322,1068
1731,Merging Blog App Into The Shop UI | Python Django Tutorials In Hindi #55,2019-02-24T02:30:00Z,17504,664,84
1732,Django Solution To Exercise 4: Display Prices  | Python Django Tutorials In Hindi #54,2019-02-23T12:15:00Z,16870,516,80
1733,E-Commerce Website: Displaying Order Items In Tracker | Python Django Tutorials In Hindi #53,2019-02-23T02:30:01Z,20689,621,75
1734,Django Exercise 4: Display Prices | Python Django Tutorials In Hindi #52,2019-02-22T12:15:00Z,14479,654,81
1735,Creating Order Tracker For Customers | Python Django Tutorials In Hindi #51,2019-02-22T02:30:00Z,39965,1295,227
1736,Creating Database Entry For Orders | Python Django Tutorials In Hindi #50,2019-02-21T12:15:00Z,29600,1207,147
1737,Adding Items On Checkout Page | Python Django Tutorials In Hindi #49,2019-02-21T02:30:00Z,26572,1079,226
1738,Creating The Checkout Page | Python Django Tutorials In Hindi #48,2019-02-20T12:15:00Z,24038,919,71
1739,Adding Checkout & ClearCart Buttons | Python Django Tutorials In Hindi #47,2019-02-20T02:30:03Z,25577,860,323
1740,Exercise 3: Solutions + Shoutouts | Python Django Tutorials In Hindi #46,2019-02-19T12:15:01Z,15664,1192,59
1741,Creating A Cart In Navigation Bar As Popover | Python Django Tutorials In Hindi #45,2019-02-19T02:30:00Z,27504,806,92
1742,Creating Add and Remove Buttons For Items In Cart | Python Django Tutorials In Hindi #44,2019-02-18T12:15:00Z,42965,1139,226
1743,Exercise 3: Improving Cart Of Our E commerce Website | Python Django Tutorials In Hindi #43,2019-02-18T02:30:02Z,23153,972,95
1744,E Commerce Website: Creating Contact Page + Database | Python Django Tutorials In Hindi #42,2019-02-17T12:25:57Z,38233,1167,111
1745,E Commerce Website: Creating Product Page | Python Django Tutorials In Hindi #41,2019-02-17T02:30:00Z,46275,1521,168
1746,Adding Cart PopOver & Other Pages Using Bootstrap | Python Django Tutorials In Hindi #40,2019-02-16T12:15:01Z,38631,1495,128
1747,Adding Bootstrap Row & Some CSS | Python Django Tutorials In Hindi #39,2019-02-16T02:30:00Z,29758,1358,86
1748,Improving Slider Logic & Adding Cart Items Count | Python Django Tutorials In Hindi #38,2019-02-15T12:15:00Z,40875,1347,115
1749,Exercise 3: Solution + Shoutouts | Python Django Tutorials In Hindi #37,2019-02-15T02:30:01Z,26133,949,269
