,Title,Published_date,Views,Likes,Comments
530,JavaScript in 8 Minutes 👩‍💻,2022-02-25T11:30:00Z,176371,7686,388
531,Creating endpoints to get one/all blogposts | NextJs Tutorial for Beginners #18,2022-02-25T04:37:14Z,27859,720,67
532,Introduction to API Routes in Next.js | NextJs Tutorial for Beginners #17,2022-02-24T12:12:29Z,29038,794,83
533,Adding blog jsons as data | NextJs Tutorial for Beginners #16,2022-02-24T02:30:17Z,24863,744,85
534,Creating Blog and Blogpost page | NextJs Tutorial for Beginners #15,2022-02-23T11:30:21Z,29281,847,97
535,Displaying Navbar on all pages | NextJs Tutorial for Beginners #14,2022-02-23T02:30:00Z,38884,887,79
536,Basic Cleanup of Hunting Coder Blog | NextJs Tutorial for Beginners #13,2022-02-22T15:30:04Z,23277,742,100
537,Styled jsx in Next.js | NextJs Tutorial for Beginners #12,2022-02-22T05:01:22Z,24597,851,94
538,Java in 7 Minutes 🔥,2022-02-20T04:29:24Z,184126,8682,539
539,Adding Global Styles in Next.js | NextJs Tutorial for Beginners #11,2022-02-19T11:30:17Z,27195,829,77
540,[Updated Feb 2022] Laptop models to buy around 70k budget,2022-02-17T15:56:22Z,130376,5833,879
541,Component Level CSS in Next.js | NextJs Tutorial for Beginners #10,2022-02-16T11:30:08Z,35726,1063,124
542,Link component in Next.js -  Understanding next/link | NextJs Tutorial for Beginners #9,2022-02-15T11:30:08Z,36233,936,106
543,C++ in 5 Minutes 🔥,2022-02-14T11:30:00Z,122844,6595,379
544,"C++, Java or Python? The best Language for College Placements in India",2022-02-13T06:12:45Z,203209,10506,543
545,"Tailwind CSS Course Conclusion, Wrap-up & where to go from here",2022-02-12T12:49:34Z,41385,2588,334
546,Creating Multiple Pages in Next.js | NextJs Tutorial for Beginners #8,2022-02-11T13:36:13Z,43335,1209,158
547,Blogging in 2022? 💻,2022-02-10T12:59:09Z,41352,2369,274
548,Image Component in Next.js | NextJs Tutorial for Beginners #7,2022-02-09T11:30:23Z,45053,1166,164
549,CSS in 7 Minutes 🔥,2022-02-09T03:25:43Z,236425,9578,344
550,Head and Script Component in Next.js | NextJs Tutorial for Beginners #6,2022-02-08T11:30:01Z,47665,1309,118
551,Project 1: Hunting Coder - A Coder's Blog | NextJs Tutorial for Beginners #5,2022-02-07T15:03:02Z,68213,2265,213
552,5 Typing Softwares I used to improve typing speed 🔥,2022-02-06T11:30:57Z,62748,3272,305
553,JavaScript and React Refresher for Next.js | NextJs Tutorial for Beginners #4,2022-02-06T05:31:53Z,52422,1534,227
554,99.9% developers don't use this in VS Code! 🔥 #shorts,2022-02-05T14:25:08Z,322564,31221,445
555,"Don't Use HTML, CSS & JavaScript (Do this instead!)",2022-02-04T11:30:09Z,360085,14420,654
556,Project 2: Microsoft Clone (Responsive) in Tailwind CSS: Tailwind Tutorial #15,2022-02-03T11:30:02Z,91563,2330,247
557,HTML id vs class 🔥 #shorts,2022-02-03T05:30:06Z,91427,9229,112
558,HTML in 9 Minutes (in Hindi) 🌐,2022-02-02T07:16:45Z,334717,14201,524
559,File Based Routing in Next.js | NextJs Tutorial for Beginners #3,2022-02-01T11:30:14Z,72624,2015,250
560,5 Typing Websites I used to Master Typing!,2022-01-31T12:53:25Z,91103,5748,448
561,Our first Next.js website | NextJs Tutorial for Beginners #2,2022-01-30T12:23:03Z,153585,3839,655
562,Introduction to Next.js | NextJs Tutorial for Beginners #1,2022-01-29T06:14:42Z,294886,7949,763
563,The Harsh Truth About Typing wrt Coding 😐,2022-01-26T11:30:04Z,129037,7247,508
564,Wrap Tabs in VS Code is an awesome feature! 🔥 #shorts,2022-01-24T11:41:07Z,114398,8640,148
565,⚠WARNING: Don't Learn Tailwind CSS before Learning CSS!,2022-01-23T12:51:26Z,42509,2416,263
566,Must Try this VS Code Hack #shorts 🔥,2022-01-22T11:37:09Z,92664,8434,180
567,Is it impossible to master CSS?,2022-01-21T13:35:41Z,147662,8135,551
568,Top 5 Programming Languages for 2022 🔥,2022-01-19T14:47:53Z,408799,18329,1174
569,Project 1: Facebook Clone in Tailwind CSS: Tailwind Tutorial #14,2022-01-18T12:25:04Z,84120,2402,259
570,Deploying a Tailwind Website to Production : Tailwind Tutorial #13,2022-01-17T11:30:00Z,39979,1402,167
571,Customizing Tailwind CSS using tailwind.config.js file: Tailwind Tutorial #12,2022-01-16T11:30:05Z,39951,1414,123
572,When to use @apply and @layer directive?: Tailwind Tutorial #11,2022-01-15T11:30:07Z,28804,1259,103
573,C Language in 9 Minutes (in Hindi) 🔥,2022-01-14T12:49:25Z,483721,23636,1275
574,@layer Directive in Tailwind: Tailwind Tutorial #10,2022-01-13T12:46:41Z,33178,1429,160
575,@apply directive in Tailwind CSS: Tailwind Tutorial #9,2022-01-12T13:54:42Z,41001,1595,160
576,"Hover, Focus & Other States in Tailwind CSS : Tailwind Tutorial #8",2022-01-08T11:30:04Z,51388,1844,300
577,Creating Responsive Designs in Tailwind CSS : Tailwind Tutorial #7,2022-01-07T11:51:44Z,61495,2275,316
578,Square Bracket Notation in Tailwind CSS : Tailwind Tutorial #6,2022-01-05T13:22:29Z,48813,1792,194
579,"Margins, Borders & Padding in Tailwind CSS : Tailwind Tutorial #5",2022-01-04T11:30:11Z,55838,1767,179
580,Fonts & Sizing : Tailwind Tutorial #4,2022-01-03T11:30:15Z,74710,2180,193
581,Why use Tailwind CSS? : Tailwind Tutorial #3,2022-01-02T11:53:18Z,94155,3067,311
582,Sweet Spot PC Build for ML & Android Studio 🔥,2022-01-01T11:06:57Z,155957,7924,655
583,Our First Tailwind CSS Website: Tailwind Tutorial #2,2021-12-31T12:18:02Z,203953,5141,809
584,Introduction to Tailwind CSS & Utility first Workflow: Tailwind Tutorial #1,2021-12-30T15:12:13Z,427354,11950,1062
585,Python in 8 Minutes (in Hindi) 🐍,2021-12-28T07:49:34Z,997784,39810,1141
586,Strapi Headless CMS can save a lot of API Development time 🔥 #shorts,2021-12-23T05:39:37Z,84991,6659,130
587,"Personal Portfolio website using pure HTML, CSS and JavaScript",2021-12-22T13:10:00Z,1145037,33285,1962
588,Bootstrap in 2022 - A big NO ❓❓,2021-12-21T11:30:21Z,316641,11454,1011
589,5 Ways to Host a Website for Free!!! 🆓🙌,2021-12-21T07:15:17Z,456462,49279,287
590,7 Coding Myths - Busted! 🕵️‍♂️,2021-12-20T11:47:12Z,226052,14260,685
591,Why everyone should learn to Code in 2022? (The Reason!),2021-12-18T13:32:50Z,84893,5869,583
592,5 ways to customize chrome homepage 🔥 #shorts,2021-12-17T07:29:58Z,118318,11918,126
593,Landing Page vs Website - The Difference! 🔥 #shorts,2021-12-13T05:30:12Z,72275,5367,99
594,GitHub Desktop saves a lot of time & hassles 🔥 #shorts,2021-12-09T07:21:30Z,75129,6124,135
595,Python Quiz: 99.9% wont get this right! #shorts,2021-12-08T05:37:02Z,164952,12029,288
596,Can you learn Coding post 30?,2021-12-07T12:37:19Z,72332,3219,532
597,Live Preview HTML in VS Code 🔥,2021-12-07T05:30:08Z,166474,15903,187
598,Yarn Vs Npm #shorts,2021-12-06T05:30:01Z,47139,3520,124
599,Fun Things to do with Google Search #shorts 🔥,2021-12-05T05:30:40Z,185844,16594,142
600,Lively Wallpapers is an amazing Windows 11 Application 🔥 #shorts,2021-12-04T05:30:01Z,65911,5075,124
601,Image search in Chrome - No Extension #shorts 🔥,2021-12-03T05:30:06Z,57859,3952,118
602,What if you are not enjoying Coding?,2021-12-02T11:30:02Z,363893,19524,950
603,Pretty print JavaScript objects in NodeJS,2021-12-02T05:30:09Z,59166,4722,60
604,Find and delete unused node_module folders #shorts,2021-12-01T05:46:06Z,268404,31399,306
605,Amazing Facts About Windows 11 🔥 #shorts,2021-11-30T05:30:03Z,194297,17942,113
606,What *is* Coding?,2021-11-29T11:30:22Z,199484,11580,632
607,These 5 Chrome Extensions are amazing! 🔥 #shorts,2021-11-29T05:30:16Z,167720,17059,150
608,Advanced Google Search Tips & Tricks! 🔥 #shorts,2021-11-28T05:30:03Z,83767,8536,77
609,C vs C++ in 2022?,2021-11-27T12:41:39Z,236725,14872,771
610,Make Windows Look like MacOS using this! 🔥 #shorts,2021-11-27T05:30:05Z,141303,9586,145
611,Search Google Like a Pro! 🔥 #shorts,2021-11-26T05:30:14Z,115541,11079,157
612,Find Fonts on any Website using this free tool! 🔥 #shorts,2021-11-25T05:30:03Z,56634,6286,115
613,TabGroups in Chrome is very helpful for Coders 🔥 #shorts,2021-11-24T05:30:04Z,60098,4576,84
614,Prims Minimum Spanning Tree Algorithm (Step by Step with examples),2021-11-23T11:30:00Z,115677,3044,558
615,99.9% will fail to answer this JavaScript Question #shorts,2021-11-23T05:30:01Z,643467,47792,734
616,Start Chrome dino Trex game with the score of your choice #shorts,2021-11-22T05:30:00Z,82973,6140,116
617,"""Previous Cursor Location"" feature of VS Code will save you a lot of time 🔥 #shorts",2021-11-21T05:30:01Z,155967,14235,103
618,C++ करूँ या Java? [All Doubts Cleared],2021-11-20T13:49:23Z,622806,28709,1434
619,This is my favorite VS Code Feature 🔥 #shorts,2021-11-20T05:30:12Z,251435,29427,241
620,Calculating Spanning tree Cost & Minimum Spanning Tree,2021-11-19T11:30:57Z,64836,2125,207
621,These Unique Microsoft Edge Features are not present in Chrome **yet** 🔥 #shorts,2021-11-19T05:30:06Z,259821,25163,204
622,Spanning Trees & maximum no of possible spanning trees for complete graphs,2021-11-18T13:05:14Z,65389,2098,278
623,Know this to rank your site in Google 🔥 #shorts,2021-11-18T05:30:03Z,60968,5815,73
624,Convert Image to Text directly in Chrome - No external application needed 🔥 #shorts,2021-11-17T05:30:01Z,110170,9751,173
625,This Chrome feature to Manage your tabs is awesome! #shorts,2021-11-16T05:30:04Z,79142,5510,240
626,Must learn this Chrome Tab *Trick* to maximize productivity 🔥#shorts,2021-11-15T05:30:06Z,97574,8541,267
627,Enable this secret AI feature in Chrome 🔥 (Right Now!) #shorts,2021-11-14T05:30:05Z,152026,13796,301
628,NextJs in 7 Minutes 🔥,2021-11-13T11:30:07Z,191984,8256,468
629,This tool will help you read any PDF as Audiobook 🔥 #shorts,2021-11-13T05:30:04Z,74547,6403,138
630,Hate Mathematics? Here's where Maths is not required for Coding?,2021-11-12T11:30:04Z,142048,10475,727
631,You cannot go back to Windows 10 From Windows 11 😢 #shorts,2021-11-12T05:30:01Z,112717,7639,224
632,My Secret Technique to Learn a Programming Language/Technology (Step by Step),2021-11-11T11:30:05Z,175897,11781,485
633,Watch YouTube Lectures Like a Pro 🔥 #shorts,2021-11-11T06:10:27Z,198781,20095,298
634,DFS Implementation in C | C Code For Depth First Search,2021-11-10T11:30:19Z,82731,2217,177
635,Another Free Microsoft App for your Mobile #shorts 🔥,2021-11-10T06:15:59Z,85265,6781,150
636,Why are some people so good at coding? (Copy These),2021-11-09T11:30:07Z,193301,12648,749
637,A clever trick to use Inspect Element smartly in Chrome 🔥 #shorts,2021-11-09T05:30:10Z,689145,71953,346
638,Know this before upgrading to Windows 11 😡,2021-11-08T11:30:17Z,337234,15293,2410
639,All Web Developers should know this Chrome Internet Speed Trick! 🔥 #shorts,2021-11-08T05:41:50Z,284104,29962,330
640,Enable these options in VS Code now! #shorts,2021-11-07T05:30:01Z,467775,34225,333
641,Depth First Search (DFS) Graph Traversal in Data Structures,2021-11-06T11:30:01Z,109778,3057,206
642,This VS Code feature will change the way you present 🔥 #shorts,2021-11-06T05:48:24Z,141349,12844,255
643,Why I am Uninstalling Windows 11 😢,2021-11-05T12:50:24Z,410853,23574,2145
644,How a Coder Plays Google Chrome’s T-rex Game Using JavaScript! #shorts,2021-11-05T06:31:51Z,4410769,290943,423
645,BFS Implementation in C | C Code For Breadth First Search,2021-11-04T11:30:06Z,138845,2981,276
646,How to install Fonts from One Computer to Another in Windows? #shorts,2021-11-04T05:29:35Z,70385,4068,192
647,Breadth First Search (BFS) Graph Traversal in Data Structures,2021-11-03T11:33:28Z,150898,4216,231
648,This JavaScript trick will amaze your friends 🔥 #shorts,2021-11-03T05:14:46Z,841258,71611,720
649,Use this *free* Microsoft application to improve your productivity #shorts,2021-11-02T05:11:35Z,136041,7997,322
650,5 HTML Tags I bet you didn't know about! #shorts,2021-11-01T07:11:23Z,994809,107886,2046
651,The Logic Building Mindset you need to solve any Competitive Coding Question!,2021-10-31T11:30:18Z,569952,29501,862
652,How Much Does Coding Help in Stock Market (Money Making Tips) 🔥,2021-10-30T11:05:55Z,154153,8320,511
653,Downsides of a being a Software Dev - by a Software Dev!,2021-10-29T11:30:23Z,72010,4989,542
654,Choose this out of Competitive Programming Vs Software Development in College!,2021-10-28T11:30:28Z,118748,8321,486
655,Windows 11 Upgrade + Get those missing features back! 🔥,2021-10-27T11:55:17Z,116504,6362,1169
656,Which Resource to Choose for Learning Coding | Book? Videos? Text or...,2021-10-25T11:30:05Z,177939,10246,765
657,1.5 Lakhs/Month Coding Job Without a Degree? 😲😲,2021-10-24T11:30:10Z,434683,21086,1066
658,Will Web Development Eventually Die?,2021-10-23T05:30:00Z,133808,8691,677
659,Graph traversal & Graph traversal algorithms,2021-10-22T14:19:01Z,100422,3843,392
660,Data Science vs Software development - Which career path is the most Rewarding?,2021-10-21T11:30:02Z,472974,22300,1128
661,"Representation of Graphs - Adjacency List, Adjacency Matrix & Other Representations",2021-10-20T12:12:56Z,138237,4245,351
662,Dont Do Last Moment study but... (Few Personal Tricks),2021-10-19T11:54:55Z,44439,3648,630
663,Introduction to Graphs | Graph Data Structure,2021-10-18T11:35:31Z,217428,6365,473
664,Perks of being a Software Engineer 😍😍 - Should you be one?,2021-10-17T11:24:50Z,134796,10981,797
665,"C Code For AVL Tree Insertion & Rotation (LL, RR, LR & RL Rotation)",2021-10-16T14:49:10Z,98600,3019,413
666,How To Get Started With Coding (3 Minutes),2021-10-15T11:30:00Z,123139,9642,521
667,How I remember syntax while programming?,2021-10-14T11:30:08Z,79752,5414,373
668,"Tic Tac Toe Using only HTML, CSS & JavaScript 🔥🔥",2021-10-13T11:30:08Z,432038,15481,1868
669,How Long Does it Take to Learn a Programming Language? (Job Ready),2021-10-11T11:28:10Z,576323,33901,1283
670,"Creating a Spotify Clone Using HTML, CSS & JavaScript Only | JavaScript Music Player🔥🔥",2021-10-10T12:32:17Z,1411982,32092,2323
671,How Would I Learn To Code (If I Was To Start Over) 🔥🔥,2021-10-09T04:22:51Z,1686325,82523,2243
672,Should You Upgrade To Windows 11 Just Yet?,2021-10-08T14:33:09Z,108887,6499,742
673,Should I Learn Web Development or Android Development? (The Answer!),2021-10-07T11:30:01Z,454477,24481,1224
674,Introvert Vs Extrovert - Who gets more successful?,2021-10-06T11:30:05Z,162587,11847,959
675,Updating state from a different component in Redux | Complete React Course in Hindi #78,2021-10-05T11:30:03Z,108982,2476,640
676,College Placements - Harsh Truth!,2021-10-04T11:30:05Z,104367,6451,581
677,PC Builds for Coders - Budget PCs You Can Build This Festive Season 🔥,2021-10-03T09:17:56Z,88164,5247,504
678,Accessing State in Redux | Complete React Course in Hindi #77,2021-10-03T05:30:03Z,63724,1327,101
679,Laptop Models to Buy this Festive Season (Google Sheet Included) 🔥,2021-10-01T03:30:10Z,378900,21965,2118
680,"Student Offers, Cashbacks & Programs to join - Save Money as a student 🔥",2021-09-30T10:28:40Z,147447,9863,629
681,Fastest Way To Get Started With Web Development (3 Minutes),2021-09-29T11:30:08Z,190706,13439,737
682,Creating a Redux Store | Complete React Course in Hindi #76,2021-09-29T05:30:00Z,82390,1583,185
683,Avoid *these* Things in College (IMPORTANT!),2021-09-28T11:30:08Z,325824,24516,1096
684,Personal Early Realization Technique for productivity (3 minute technique) 🔥🔥,2021-09-27T11:45:03Z,72844,6922,523
685,Creating a Reducer & Action Creator in Redux | Complete React Course in Hindi #75,2021-09-27T06:00:08Z,90185,1877,166
686,College Will Not Teach You Coding - Here's Why!,2021-09-26T11:30:01Z,395882,29129,1395
687,Mind you - This is the best Time to Start Coding 💻 🔥,2021-09-25T11:30:14Z,49544,4757,704
688,Can You Learn Coding as a Commerce/Mechanical/Arts Student?,2021-09-24T11:30:16Z,172646,12355,1356
689,Why should you (not) write GATE 2022?,2021-09-23T11:30:09Z,369635,19235,1892
690,5 Habits of Highly Successful Coders 🔥,2021-09-22T11:30:07Z,186729,13929,629
691,Is English Important for Placements?,2021-09-21T11:30:08Z,250834,17159,992
692,Can you Code a Product from Development to Deployment (as the only coder)?,2021-09-20T11:30:06Z,61508,4731,473
693,99.9% Freelancers Will Fail Because of This!,2021-09-19T11:30:01Z,635500,33186,1548
694,5 Coding Strategies I Wish I knew since First Year of College 🔥,2021-09-18T11:30:01Z,475570,31117,1136
695,"All About Hackathons - How to Find, Participate & Win? 🔥",2021-09-17T11:30:22Z,298797,16284,618
696,Is the IIT tag really important? - My Opinions & Advises 🔥🔥,2021-09-16T07:11:15Z,398807,31913,2671
697,Setting up a React Application for Redux | Complete React Course in Hindi #74,2021-09-15T10:34:02Z,92666,1989,237
698,How to watch Online Coding Tutorials Effectively! 🔥🔥,2021-09-14T11:30:05Z,117468,9395,601
699,Introduction to Redux | Complete React Course in Hindi #73,2021-09-13T13:36:49Z,142515,3379,249
700,Fetching User Specific Notes in iNotebook | Complete React Course in Hindi #72,2021-09-12T09:54:48Z,47733,1440,551
701,"Adding Alerts to Login, Signup & Notes Component of iNotebook | Complete React Course in Hindi #71",2021-09-12T09:32:38Z,34918,1038,130
702,Should You use Libraries Or Code from Scratch?,2021-09-11T12:16:08Z,32650,2013,253
703,5 JavaScript Concepts Everyone Should Learn! 🔥,2021-09-10T06:43:55Z,120406,7015,941
704,Should You Mention Copied Projects From Internet in Your Resume?,2021-09-08T07:51:13Z,374979,15608,577
705,Adding SignUp Component to iNotebook | Complete React Course in Hindi #70,2021-09-07T15:30:14Z,39336,1394,175
706,Adding Login Component to iNotebook | Complete React Course in Hindi #69,2021-09-07T14:06:43Z,49025,1438,216
707,Adding Frontend Validation + Few Fixes in iNotebook | Complete React Course in Hindi #68,2021-09-07T11:35:55Z,31029,1085,156
708,Updating Notes on edit in the UI using React | Complete React Course in Hindi #67,2021-09-07T08:40:22Z,32252,951,142
709,Adding a Modal for Editing Notes | Complete React Course in Hindi #66,2021-09-07T06:45:41Z,48736,1101,296
710,"Adding ""fetch notes"" functionality to iNotebook | Complete React Course in Hindi #65",2021-09-07T05:01:58Z,41195,1144,234
711,"Adding ""delete note"" functionality to iNotebook | Complete React Course in Hindi #64",2021-09-07T04:20:39Z,31345,1018,79
712,Adding AddNote component to iNotebook | Complete React Course in Hindi #63,2021-09-07T03:27:47Z,40632,1174,122
713,Adding font awesome icons to iNotebook | Complete React Course in Hindi #62,2021-09-06T14:07:56Z,44061,1557,131
714,iNotebook: Adding NoteItem in a Separate Note component | Complete React Course in Hindi #61,2021-09-06T12:41:28Z,34481,1284,74
715,iNotebook: Fetching Notes from Context | Complete React Course in Hindi #60,2021-09-06T11:30:23Z,44628,1328,101
716,useLocation Hook in React | Complete React Course in Hindi #59,2021-09-06T10:04:10Z,46172,1655,126
717,useContext hook: Using React Context API | Complete React Course in Hindi #58,2021-09-05T13:22:22Z,129231,3124,271
718,Introduction to React Context API | Complete React Course in Hindi #57,2021-09-05T10:55:36Z,62164,2073,126
719,Creating Navbar and Routes | Complete React Course in Hindi #56,2021-09-05T10:12:22Z,68755,1594,131
720,iNotebook React Project Setup | Complete React Course in Hindi #55,2021-09-05T10:02:55Z,44393,1462,148
721,Endpoint for deleting a Note | Complete React Course in Hindi #54,2021-09-04T11:47:56Z,32546,1712,400
722,Updating an existing Note | Complete React Course in Hindi #53,2021-09-04T11:47:17Z,35996,1281,142
723,Fetching all notes & Adding a Note | Complete React Course in Hindi #52,2021-09-04T11:46:45Z,48378,1355,189
724,Creating a middleware to decode user from a JWT | Complete React Course in Hindi #51,2021-09-04T11:45:56Z,54016,1570,276
725,Creating Login Endpoint & sending auth token| Complete React Course in Hindi #50,2021-09-04T11:44:58Z,55296,1563,121
726,Hashing Passwords using bcryptjs in NodeJs | Complete React Course in Hindi #49,2021-09-04T11:44:10Z,52669,1681,137
727,Windows 365 Cloud PC: My Opinions Post Release 😢,2021-09-03T10:36:34Z,54337,3130,459
728,"Understanding Password Hashing, Salt & Pepper | Complete React Course in Hindi #48",2021-09-02T16:21:00Z,50927,2229,173
729,Creating ThunderClient Collections to Manage Requests | Complete React Course in Hindi #47,2021-09-02T08:53:31Z,54766,1625,167
730,Adding Data Validation Using express-validator | Complete React Course in Hindi #46,2021-09-02T07:16:28Z,63846,1680,257
731,Storing Data into the Database Using Mongoose Model | Complete React Course in Hindi #45,2021-09-02T07:16:20Z,85791,2102,561
732,Creating Routes & Schema for Storing Notes & Users | Complete React Course in Hindi #44,2021-09-02T07:16:09Z,88823,2194,202
733,iNotebook db & Express Server Setup | Complete React Course in Hindi #43,2021-09-02T04:30:14Z,117469,2437,524
734,Windows 11 release date announced finally 🔥,2021-08-31T17:47:40Z,129762,6436,737
735,Project 3: iNotebook backend and React frontend setup | Complete React Course in Hindi #42,2021-08-31T09:08:14Z,122747,3034,255
736,Introduction to MERN stack | Complete React Course in Hindi #41,2021-08-30T11:31:46Z,158187,4788,436
737,Sticky Navbar & NewsMonkey bug fixes | Complete React Course in Hindi #40,2021-08-29T17:00:08Z,61672,1795,208
738,Changing Class based NewsMonkey components to Functional based | Complete React Course in Hindi #39,2021-08-29T15:29:37Z,66232,1889,201
739,Introduction to React Hooks | Complete React Course in Hindi #38,2021-08-29T12:30:04Z,99089,2874,150
740,Hiding API Key by Adding Custom Environment Variables | Complete React Course in Hindi #37,2021-08-29T08:32:43Z,63787,2300,265
741,Adding a top loading bar to NewsMonkey | Complete React Course in Hindi #36,2021-08-28T15:30:05Z,63813,2071,310
742,Adding Infinite Scroll to NewsMonkey | Complete React Course in Hindi #35,2021-08-28T09:19:33Z,86039,2455,547
743,React Component Lifecycle & Lifecycle methods  | Complete React Course in Hindi #34,2021-08-27T15:27:47Z,117669,3043,191
744,Refactoring News component to use the same function  | Complete React Course in Hindi #33,2021-08-27T14:16:06Z,60897,2087,284
745,"Adding time, author and news source to News React App | Complete React Course in Hindi #32",2021-08-27T10:40:00Z,57566,1945,141
746,Fetching News category wise in NewsMonkey React App | Complete React Course in Hindi #31,2021-08-27T08:39:05Z,76313,2161,505
747,Adding Categories & propTypes to NewsMonkey React App | Complete React Course in Hindi #30,2021-08-27T05:54:02Z,77022,2120,127
748,Adding loading spinner & variable pageSize to NewsMonkey | Complete React Course in Hindi #29,2021-08-27T02:30:07Z,96040,2625,192
749,Adding Previous & Next Buttons to populate NewsItems | Complete React Course in Hindi #28,2021-08-26T15:10:50Z,113987,2784,337
750,Using Fetch API in React to populate NewsItems | Complete React Course in Hindi #27,2021-08-26T13:59:41Z,134055,3041,467
751,Looping through an array in JSX to display NewsItems from state | Complete React Course in Hindi #26,2021-08-26T12:35:39Z,113550,3192,481
752,Understanding state in class based components  | Complete React Course in Hindi #25,2021-08-26T11:50:02Z,124390,2926,105
753,Fetching API Key from News API | Complete React Course in Hindi #24,2021-08-26T11:31:34Z,162206,3550,200
754,Component Structure of our NewsMonkey React App | Complete React Course in Hindi #23,2021-08-26T09:22:25Z,138609,3797,245
755,Project 2 Setup + Introduction to Class based components | Complete React Course in Hindi #22,2021-08-25T14:30:21Z,150581,4177,271
756,Fixing few more Textutils Issues | Complete React Course in Hindi #21,2021-08-25T07:52:42Z,71216,2253,218
757,Exercise 2: Solutions + Shoutouts | Complete React Course in Hindi #20,2021-08-24T15:30:02Z,82458,2165,193
758,Fixing Issues & Wrapping up TextUtils | Complete React Course in Hindi #19,2021-08-24T09:00:14Z,125392,3185,460
759,"Should you use HTML, CSS, JavaScript or Frameworks for your next Website?",2021-08-23T07:58:57Z,138342,6970,454
760,Purchasing a Domain + Hosting TextUtils on a VPS | Complete React Course in Hindi #18,2021-08-22T16:45:48Z,106921,3130,285
761,[Free] Building + Hosting React App For free on Github Pages | Complete React Course in Hindi #17,2021-08-21T11:41:53Z,203000,4787,503
762,How much JavaScript is needed to learn React?,2021-08-20T14:17:25Z,479080,18889,732
763,React Router Setup + Usage | Complete React Course in Hindi #16,2021-08-20T06:04:52Z,268179,5347,1185
764,React vs Angular - Which one to Learn?,2021-08-19T11:33:26Z,250554,9020,688
765,Changing title dynamically & adding favicons to TextUtils | Complete React Course in Hindi #15,2021-08-19T08:11:08Z,141386,3921,173
766,Exercise 2: Adding Custom Color Theme to TextUtils | Complete React Course in Hindi #14,2021-08-18T17:16:23Z,114820,2938,518
767,Adding + Auto Dismissing Alert Messages | Complete React Course in Hindi #13,2021-08-18T14:30:09Z,202780,5415,1077
768,Improving Dark Mode & Refactoring App Component | Complete React Course in Hindi #12,2021-08-18T12:49:07Z,256197,5861,649
769,Exercise 1: Solutions + Shoutouts | Complete React Course in Hindi #11,2021-08-18T09:57:41Z,157675,3820,633
770,"Creating ""Enable Dark Mode"" Button Using useState Hook  | Complete React Course in Hindi #10",2021-08-18T08:28:16Z,277322,6700,479
771,Exercise 1: Enhancing TextUtils | Complete React Course in Hindi #9,2021-08-17T14:03:43Z,192071,5911,1926
772,Adding more Logic to TextUtils | Complete React Course in Hindi #8,2021-08-17T12:20:54Z,252911,6778,433
773,Understanding State & Handling Events in React | Complete React Course in Hindi #7,2021-08-17T10:29:47Z,463136,10365,709
774,Understanding Props and PropTypes in React | Complete React Course in Hindi #6,2021-08-17T08:39:21Z,528518,11301,945
